{
  "match_id": "550e8400-e29b-41d4-a716-446655440000",
  "epoch": 3,
  "tick": 500,
  "seq": 0,
  "event_type": "hack",
  "payload": {
    "attacker_id": "drone-A-001",
    "target_id": "drone-B-003",
    "target_firewall_before": 2,
    "target_firewall_after": 1,
    "payload_module": "worm"
  }
}